<?xml version="1.0"?>
<xs:schema xmlns:xs="http://www.w3.org/2001/XMLSchema">
    <xs:element name="order">
        <xs:complexType>
            <xs:sequence>
                <xs:element name="userId" type="xs:long"/>
                <xs:element name="product" maxOccurs="unbounded">
                    <xs:complexType>
                        <xs:sequence>
                            <xs:element name="productId" type="xs:long"/>
                            <xs:element name="productName" type="xs:string"/>
                            <xs:element name="price" type="xs:string"/>
                            <xs:element name="quantity" type="xs:integer"/>
                            <xs:element name="category" type="xs:string"/>
                        </xs:sequence>
                    </xs:complexType>
                </xs:element>
                <xs:element name="creationDate" type="xs:string"/>
            </xs:sequence>
            <xs:attribute name="id"/>
        </xs:complexType>
    </xs:element>
</xs:schema>